{
  "$schema": "https://json-schema.org/draft/2020-12/schema",
  "type": "object",
  "properties": {
    "schema_version": {
      "type": "string",
      "const": "1.0.0"
    },
    "id": {
      "type": "string",
      "format": "uuid",
      "pattern": "^([0-9a-fA-F]{8}-[0-9a-fA-F]{4}-[1-8][0-9a-fA-F]{3}-[89abAB][0-9a-fA-F]{3}-[0-9a-fA-F]{12}|00000000-0000-0000-0000-000000000000|ffffffff-ffff-ffff-ffff-ffffffffffff)$"
    },
    "session_id": {
      "type": "string",
      "format": "uuid",
      "pattern": "^([0-9a-fA-F]{8}-[0-9a-fA-F]{4}-[1-8][0-9a-fA-F]{3}-[89abAB][0-9a-fA-F]{3}-[0-9a-fA-F]{12}|00000000-0000-0000-0000-000000000000|ffffffff-ffff-ffff-ffff-ffffffffffff)$"
    },
    "owner_id": {
      "type": "string",
      "format": "uuid",
      "pattern": "^([0-9a-fA-F]{8}-[0-9a-fA-F]{4}-[1-8][0-9a-fA-F]{3}-[89abAB][0-9a-fA-F]{3}-[0-9a-fA-F]{12}|00000000-0000-0000-0000-000000000000|ffffffff-ffff-ffff-ffff-ffffffffffff)$"
    },
    "modality": {
      "type": "string",
      "enum": [
        "audio",
        "video",
        "transcript"
      ]
    },
    "source_epoch": {
      "type": "integer",
      "minimum": 1,
      "maximum": 9007199254740991
    },
    "start_ms": {
      "type": "integer",
      "minimum": 0,
      "maximum": 9007199254740991
    },
    "end_ms": {
      "anyOf": [
        {
          "type": "integer",
          "minimum": 0,
          "maximum": 9007199254740991
        },
        {
          "type": "null"
        }
      ]
    },
    "reason": {
      "type": "string",
      "enum": [
        "silence",
        "packet_expired",
        "source_lost",
        "paused",
        "clock_skew",
        "session_end",
        "unknown"
      ]
    }
  },
  "required": [
    "schema_version",
    "id",
    "session_id",
    "owner_id",
    "modality",
    "source_epoch",
    "start_ms",
    "end_ms",
    "reason"
  ],
  "additionalProperties": false
}
