{
  "schema_version": "1.0.0",
  "id": "00000000-0000-4000-8000-000000000006",
  "session_id": "00000000-0000-4000-8000-000000000001",
  "owner_id": "00000000-0000-4000-8000-000000000002",
  "modality": "audio",
  "source_epoch": 1,
  "start_ms": 1700000004000,
  "end_ms": null,
  "reason": "silence"
}
